userName,content,score,at
Gloria Serido,recently I've noticed many changes. it was always my default app for movies but lately all I see are old movies and things I've never even heard of before. I had to go through the hassle of resigning in on both tvs on multiple occasions. I know some things have changed and I'm just beginning to see them. I liked it better the old way or maybe I'll just switch to Hulu or one of the other movies apps.,3,10/14/2025 22:31
Lem Sardnejo,"First of all. The options of payment are ridiculously unfair. 619 pesos and 4 gadgets only? we are a family of 15, maybe at least 5 of us or 6 should have access with it but you lowered it down to 4 only.",1,10/14/2025 22:30
Anil Dodia,Excellent,5,10/14/2025 22:21
Sutapa Kar mahapatra,it's fun🫶,4,10/14/2025 22:20
Rin,"library is not good enough, doesn't have full season of series. keep freezing",1,10/14/2025 22:14
Lynne Griffiths,Ca,1,10/14/2025 22:09
Eric,Way too many ads. May as well switch back to cable.,1,10/14/2025 22:05
Gopi Krishna Gundapaneni,dirty app this world Worst app in the world,1,10/14/2025 22:01
Atika Khatun,waste of money 🤡💩,1,10/14/2025 21:45
Lumka April,Perfect,5,10/14/2025 21:36
Choumchart Man,"disappointed. I can not search the movies,I want to see. The movies is limited. I pay the money,but I cannot get what I want. I need to change!!!!",2,10/14/2025 21:26
MothCloak,This obsession with forcing massive banner recommendations with barely any summary and getting rid of newest/latest especially on smart TVs is exhausting and I WILL cancel my subscription for good.,1,10/14/2025 20:59
Amaya Graham,It takes forever for me to get to the show. But when I do I get the best experience,5,10/14/2025 20:40
Dibyendu Sen,good,5,10/14/2025 20:33
NAYLIN OO,SAIAUNGMURNG,5,10/14/2025 20:27
Amelia Thornberg,love it but they kneed to get more animas on there,5,10/14/2025 20:26
Segfred De Los Santos,Just pls let me pay man im tired of this why wont mobile carrier work,1,10/14/2025 20:25
Paul L,"Now, all of a sudden, I need to create a new account or need temporary access at work (away from household) to watch Netflix, even with a PREMIUM membership, after all these years? Well, I dropped my premium membership today and decided not to pay a penny to this greedy company. I kind of understood when they started to control membership sharing, but there's no way that I'd understand them limiting my use of Neflix to household area.",1,10/14/2025 20:23
Ankit Kumar,Nice,5,10/14/2025 20:15
Lillian VandeVyver,ridiculous prices nothing else needs to be said I will be canceling i no longer support this company,1,10/14/2025 19:53
NAjma Cabdi samet,😻🩶,5,10/14/2025 19:12
Danielle Armstrong,"so many problems to much money always buffing ,,can only watch from home, low turn over,and way to many foreign films/shows",2,10/14/2025 18:58
Zan Dewi,always having problems when I tried to watch anything. Closed and opened it again and again but the problem persists,1,10/14/2025 18:53
Shanavi,I love the app and the shows but I wish could have more options and also I love watching miraculous ladybug but they just stop adding more episodes to watch it I had to go to some random website 🥲,4,10/14/2025 18:43
MUKESH J,worst app ever,1,10/14/2025 18:34
Louisia Allexandra,good,5,10/14/2025 18:22
yousuf,garbage,1,10/14/2025 18:20
Rongel Jimenez,can you add please for free watch 🙏,1,10/14/2025 18:04
Jack Volpe,Awsome Content Thxs 👍,5,10/14/2025 17:59
Fake bemo,Never gonna recharge n waste my money again.....cant even download anything as it shows unavailable n telling me ive downloaded in other profile n yes i did but i deleted it all so i should b able to download again...ive even log out n log in but no use,1,10/14/2025 17:32
Fezeka Vilakazi,I can't create a Netflix account is keeps on saying I have an account when I don't have one,1,10/14/2025 17:07
Muhammed Umoru,EXCELLENT SERVICE THANKS 😊,5,10/14/2025 16:47
srinuvasarao 143 i love my india K,గుడ్,5,10/14/2025 16:45
Dj muntari Madaci,Djmuntarimadac,5,10/14/2025 16:43
Anayat Ullah,“I love how simple and useful this app is — highly recommended!”,5,10/14/2025 16:27
Kartik Raina,broo please add victorious new seasons,5,10/14/2025 15:34
Ralph Abakah Ofori,does not install,1,10/14/2025 14:49
Rhia Mae Maloles,"Can't play movies or series in Infinix Note 30 5g. Please fix this issue, it has been 5 months since I experienced this.",1,10/14/2025 14:48
MUNAFA KHATUN,nice but many serises is not convert hindi audio but I like most,5,10/14/2025 14:34
ZD Sta Ana,can you let me download the wwe 2k25 pls 🙏,2,10/14/2025 14:08
Masese Thejoker,Put on family Guy 😭❤️,5,10/14/2025 14:06
Ramji Bhai,best app,2,10/14/2025 14:03
Wasim Sayed,If possible could you please add Inazuma Eleven series 🤗,4,10/14/2025 13:50
john van den broek,good,5,10/14/2025 13:37
Leslie Jackson,"Since it's an UNWANTED APP, it deserves a ZERO-STAR rating for being a pre-installed App that wastes space, since it provides NO UNINSTALL option...!!!",1,10/14/2025 13:29
Glenn Abrahamsen,"You have to do something with the ""not part of this household"" function. It worked fine yesterday and a month before on our kids pad, this morning when the owner is at work as a nurse and me with no access to her mail it gives me the ""not part of your household"".",1,10/14/2025 13:25
Venu,block buster app,5,10/14/2025 13:18
Aliki Turagakula,why can't Netflix can't update on this device,1,10/14/2025 13:13
Eljay Rich,incredibly obnoxious issues with lighting. when I am playing picture in picture it keeps making the brightness on my phone incredibly bright. makes it impossible to use while traveling on dimly lit planes or while trying to rest. this bug has been persisting for literally years.,1,10/14/2025 13:08
Levent Doğrular,"Even at premium and all the options turned on, i see lower quality images that what pirate sites have.",1,10/14/2025 13:01
Ally triple Abdallah,the app is amazing but it still cover a lot of time and bundle while downloading movies,2,10/14/2025 12:50
Joseph Soto,so good I farted,5,10/14/2025 12:47
Kurt Jenney,unbearable to use at night due to max screen brightness bug. Restricts screen brightness controls to prevent it from being changed at all. please let me keep my screen as dark as I want. I cannot use this app until this broken feature is fixed.,1,10/14/2025 12:46
Kalepo Fiu,❤️ Kalepo Fiu ❤️ Movies Movie.,5,10/14/2025 12:37
Khayriyyah,love Amazing 😍 love Videos TV show TV series cartoons and anime and all Movies cartoon movies to HD 200 Star,5,10/14/2025 12:19
Lucia D,dejó de funcionar en mí celular con una de las últimas versiones,1,10/14/2025 12:15
Deepak Rana,love is sharing a password,1,10/14/2025 11:23
Ashok Athare,the App Nitflix In Movies And Sirig In Tha Download For Tha App,5,10/14/2025 11:17
Mariela Bido,Love this app no matter how much time asses. It will always be one of my Classics's love. The best movie/ show app of all times,5,10/14/2025 11:04
Dawn,so far God's the Boss mercie,5,10/14/2025 10:32
Nick,Your welcome dear friend how are your family doing this weekend? To get through it and I have to go back home because I have 5th class and then I'm going to work on a new schedule for my school.,4,10/14/2025 10:15
Lekha Chakraborty,usefull app,5,10/14/2025 9:51
Bacilio Mejia,Good,5,10/14/2025 9:43
Nixie,"I can't go on other apps while watching it on my phone. Like, it won't let it play over apps.",2,10/14/2025 9:34
Gladys and gracious Milambo,Oh my God this app is the best the best app ever,3,10/14/2025 9:30
Bhavin B,"A very good app, to watch all the movies. Every week there is a new set of movies to watch for and the price also budget friendly",5,10/14/2025 9:28
Dhanjit Boro,lol 😂 only 3.9 rating ⭐,5,10/14/2025 9:24
Ava M Washington,No new version for older Fire Kindle,2,10/14/2025 9:20
Olaleye Abideen,I don't know why I can't watch movies every time on this app,2,10/14/2025 9:01
Stephen Roberson,runs smooth,4,10/14/2025 8:56
Cece Loyal,"I love Netflix, but I don't need it on my phone. unfortunately I didn't install it on my phone. app auto downloaded itself and I can't even uninstall the unused app. It's Just taking up space.",2,10/14/2025 8:40
Brandon,it's a really amazing place to watch movies and shows,5,10/14/2025 8:11
David Castañeda,why I can't uninstall this horrible app from my phone....,1,10/14/2025 7:50
Danilo Alves,"Olá, equipe da Netflix! 👋 Sou assinante e gostaria de pedir que a plataforma invista ainda mais em animes —tanto em novas produções originais quanto na compra de direitos de animes populares do momento. O público brasileiro é muito fã desse gênero e adoraria ver mais títulos grandes, como Jujutsu Kaisen, Demon Slayer, Solo Leveling e outros, disponíveis no catálogo. A Netflix já provou que sabe fazer animes incríveis, como Cyberpunk: Edgerunners e Frieren: Além da Jornada. perdido de um fã",4,10/14/2025 7:34
Marcus Render,excellent,5,10/14/2025 7:20
Sonni Rose Dingle,5 Star app Ive been using ts for yearssd,5,10/14/2025 7:20
Paula Adelman,bad,1,10/14/2025 5:40
Ziad Aissa,الزنا,1,10/14/2025 5:24
HUSAN,"To the Netflix Content Team, ​My name is Husan, and I am a concerned Muslim viewer subscribing to your service from Italy. I am writing to express my deepest concern and strong objection to your newly released K-Drama series, ""Genie, Make a Wish."" ​The series features a male Genie character prominently referred to as 'Iblis'. As you may be aware, in the Islamic faith, Iblis is the equivalent of Satan (Shaitan) or the ultimate embodiment of evil. ​The decision to portray a figure of such profound",1,10/14/2025 5:23
Sage Brown,was good now its always logging me out every 2 hours sad thing is I really loved netflix now i don't want it. would rather watch somewhere else,1,10/14/2025 5:19
Sam the great,"If Netflix can afford a game section, I'm sure they can afford people letting their friends use their accounts long distance. not everyone is a scammer or hacker. grow up.",1,10/14/2025 5:10
Robert Mendenhall Sr,don't want it. can't delete. won't go away. stop,1,10/14/2025 5:05
rachael j,it will not work no matter the steps I use to try and fix it,1,10/14/2025 5:03
Caleb Gray,I pay $70 for the subscription and I can't even watch all movies,3,10/14/2025 5:00
Wayne Bonner,netflix almost the best of them all,5,10/14/2025 4:48
Carlos Gallegos,too many series programs,2,10/14/2025 4:08
Louis Joubert,every time I find a interesting movie on tiktok when I search it the answer I get is we don't have this it's time to unsubscribe I'm wasting my money hair,1,10/14/2025 4:06
adedeji solomon,it is a very good app and it is use to load many movies,5,10/14/2025 3:59
Ebuka John alilionu John,good,5,10/14/2025 3:54
Radu-Daniel .Carp,"o mizerie de aplicație, de fiecare când vreau sa vizionez un film îmi apare eroare 5.8, am făcut tot ce scrie pe site-ul lor și tot nu merge.",1,10/14/2025 3:52
Sonu singh,good,5,10/14/2025 3:45
Ry Smith,piss poor restarts programmes half way thru and that's it.... 2 x 1st half's of everything you ever wanted to watch,1,10/14/2025 3:18
Madhuparni Chatterjee,useless app ever!,1,10/14/2025 2:57
kim Roberts,Yu Menglong long name has been removed from Eternal Love. Inquiring minds want to know why?,1,10/14/2025 2:53
Amanda Lindsay,update password,5,10/14/2025 2:39
Angelito Paris,so many free streaming platform nowadays.,1,10/14/2025 2:26
shekhar pareek,I purchased a subscription but when I turned off auto pay it not working.. biggest fraud netflix...shame on you ..I Will never purchase netflix subscription,1,10/14/2025 2:14
Penelope Rox,"The algorithm silos content way too much! The content selection has gotten so terrible that it's laughable. Netflix is going overboard with their quantity v. quality business model. They really need to stop wasting money on creating stupid games that no one asked for and use that money on purchasing better content. Doesn't make sense to keep paying for a subscription on the off chance that one day, maybe... something good might be offered.",1,10/14/2025 1:30
Divyesh Kulkarni,"Kindly introduce 2x, 2.25x and 2.5x options as playback speed. Apartwise, everything is perfect for now.",4,10/14/2025 1:26
Anita Sadre,very good channel.,5,10/14/2025 1:21
Suresh Kumar Naidu,superb,5,10/14/2025 1:11
Arvind k Ravi,not provide latest hindi movies mostly provide Hollywood movies.poor app.big zero ratings 000000000000000000000,1,10/14/2025 1:03
Momin Nawaz,This Is Netflix Third Class App Bad😞 Experience Error issue any time,1,10/14/2025 0:57
familijo kremerki,super kanal z fajnymi filmami. jest duzo filmow dla dzieci ale takze dla doroslych,5,10/14/2025 0:53
Eternity,"Forced update, can't watch anymore. Goodbye 😂",1,10/14/2025 0:53
Kornelia Frey,"unusable as either the password is falsely flagged as wrong or the sign in link errors out or something else, but it's trash",1,10/14/2025 0:53
Appiah Augustina,I love Netflix,5,10/14/2025 0:31
Eybomee Baumarkt,"Netflix is not part of my household anymore. It was, for 8 years!",1,10/14/2025 0:09
Jemimah Chovga,Love this app 🥰🥰🥰🥰🥰🥰🥰🥰😍,5,10/13/2025 23:52
JIL DANIEL THANGARAJ,good 👍😊,5,10/13/2025 23:47
Thummalapally Narendra,tq netflix thank you for choosing Netflix where does not appear monthly subscription amount not appear in my mobile are TV,5,10/13/2025 23:43
Cristina Puia,what did you do with the tv app ??? no longer working,1,10/13/2025 23:33
Duduman Petru,"The application is fine , the management is not. Expired series and movies are showing up as new on Netflix. If I already have seen them all, what is the point ?",1,10/13/2025 22:47
Osigwe Wilfred,one moment I'm watching a movie and I exit the app just to not find the section where I was watching moves I didn't finish and I go up to search for the movie and it's saying it's not available close the app and open it multiple times till it works after several trals,1,10/13/2025 22:35
Success,badd doesn't wanna get out my phone,1,10/13/2025 22:07
Abhay Kumar jogi,worst app in the world,1,10/13/2025 22:03
Muhammad haneef,amzing,5,10/13/2025 21:56
Marek Farkaš,I hate your game suggestion. I watch video!!!!!,1,10/13/2025 21:48
Paul Personal,It’s my first time using Netflix and I’m already bored of it within a month 😒. The movies that claim to be suspense thrillers are just a bunch of boring films! The directors don’t know anything about scriptwriting 😒,1,10/13/2025 21:33
Vae plumbing Maintenance,cant reopen app,1,10/13/2025 21:12
Soumen Chandra,গেমখেলবো,5,10/13/2025 20:56
Solulele Mshushwana,"Excellent, exceptional quality 💥",5,10/13/2025 20:53
kQira,Picture in picture doesn't work (was disabled on basic because they want more money.,1,10/13/2025 20:37
Priyanka Chouhan,"Netflix is a good platform where we get to watch very good movies and web series and its quality is also very good But if Netflix includes half yearly and yearly subscription plans along with its monthly subscription plan, then it will be more convenient for the viewers. Please consider Netflix. We will be waiting for your yearly subscription plan.",3,10/13/2025 20:36
Christian Theodoru Ilie,Pretty much useless if you have an Android device. Uninstalled after years of not working.,1,10/13/2025 20:32
Nipa Arun,please add demon slayer season 3 and 4,4,10/13/2025 20:23
Jyoti sarthak,good app,4,10/13/2025 20:17
G S,its woke,1,10/13/2025 20:09
Sajid Ansari,base of huge interesting contents,5,10/13/2025 19:50
Mystic Mac,not worthy for Money wasted🤠👍💯,1,10/13/2025 19:41
Nakul Jain,Best app I don't know why it has only 3.9 stars it's worth 5 star,5,10/13/2025 19:31
Vishal Makeover,not working,5,10/13/2025 19:18
Miraj Vardharajan,worst service,1,10/13/2025 19:06
Nityanand Dhoke,nice 👍,5,10/13/2025 18:28
Argyl Leones,DIFFICULT TO LOG IN,1,10/13/2025 18:21
PAUL Richard HAILEY,excellent service thanks,5,10/13/2025 18:19
Yeni Wang,"kenapa tiap mau nonton, loading lama teruss",1,10/13/2025 18:05
Sumant Nayak,good,5,10/13/2025 17:50
George Milroy,"The app was great. The TV shows and movies were decent. Your household policy is bad! I can't seem to watch movies and TV shows under my mom's account! Cancel your policy, please!",2,10/13/2025 17:32
mohammad izzat amir,"Netflix is my favorite streaming platform! It offers a wide variety of movies, series, and documentaries from all around the world. The interface is smooth, video quality is excellent, and new content keeps things exciting. Perfect for relaxing and binge-watching anytime!",5,10/13/2025 16:58
Pawan kumar,good 👌,5,10/13/2025 16:58
Rovisa Elias,the movies or series are not playing,1,10/13/2025 16:55
Decent Fx,NOT TOO BAD,4,10/13/2025 16:50
Op Safi,best not,4,10/13/2025 16:29
Kumar Dahal,Good,5,10/13/2025 16:17
Michael Fry-White,"How can a video streaming service be so bad at video? I get an extremely low frame rate when using the app, I'm talking 5 fps. Jerky video, and sound gets out of sync. My wife has the same on her android. It's not our extremely fast fibre connection, all other apps are FINE.",1,10/13/2025 15:53
Alex Connelly,They keep ramping up pricing or forcing ads.,1,10/13/2025 15:52
Ujjwal Aryan,I can't play my download video. I am getting troubleshooting 5:10 everytime.,3,10/13/2025 15:45
Qaizara Zara,amazing apps,5,10/13/2025 15:33
Mathavan,Very care full guys scram app in Netflix,1,10/13/2025 15:27
Ogunleye Kuburat,after downloading movies the movies will not play talkless of showing and i subscribed to the Netflix i didn't know why it's like that,1,10/13/2025 14:44
Ating Kasar,"This app doesn’t seem to be the official one 😐. I have already paid Netflix Entertainment Services India LLP, but another Netflix website is still asking me for payment.""",1,10/13/2025 14:31
Fiore Creado,"After cancelling my subscription on 29 Sep, I was again charged in 13 Oct. 2025. Netflix will not refund the money back, they are thieves. Some of my friends had to get a replacement credit card and yet Netflix would try to charge the old credit card but to no use. Netflix is not honest like AMAZON 🙏💯",1,10/13/2025 13:57
"KillaKadenZilla ,","if you connect to a wifi extender that's not seen as your own households wifi, and it forces you to receive an error screen every 14 days. there are so many other streaming services that don't have these types of issues, and netflix is starting to become not worth it.",1,10/13/2025 13:47
Peter Aina,very good,5,10/13/2025 13:27
Amitha Bal,Whatever you release is available in illegal websites. Plus uninstalled for mocking Jesus!,1,10/13/2025 12:55
Jasper,"Awesome, until the recent update, it is now so terrible and the format of the app has never been more shut. it is now Infinitily harder to scroll, you can only see like 5 shows/movies on the screen and is now much harder to navigate the app, used to be a 5 star, now a 3, whoever designed the update needs to be fired!",2,10/13/2025 12:11
Suzain Begum,To good,5,10/13/2025 12:07
Arige Gangamani,super,5,10/13/2025 11:46
Manqoba _zulu,Good app to use.,4,10/13/2025 11:37
Cadie Buchanan,very good..,5,10/13/2025 11:29
Sangita ku. Majhi,I like it but it butnot like pickashow,4,10/13/2025 10:29
Varikupalaarun,no issue,5,10/13/2025 10:03
Saad Shafi,Day by day losing tha standard,1,10/13/2025 9:34
Richard Fegley,won't let me uninstall and set up new account. Now I can't use it.,1,10/13/2025 8:41
Andrew Murphy,good,4,10/13/2025 8:34
La Garza Jo,"Can't watch this on my phone. I've uninstalled and reinstalled it, and I keep getting the same error.",1,10/13/2025 8:16
V L,I love k pop demon hunters 😂😍 but where's sailor moon cosmos? I miss it I pretty much only watch it on Netflix please ad sailor moon cosmos again!,5,10/13/2025 8:05
Casey M,"The search function isn't finding the shows that are on actually on here. Pretty silly ""feature"".",1,10/13/2025 7:49
Delylah Games,"almost every other day definitely every week for sure I have to reauthorize my netflix account, its the same one I've been using for years sometimes it makes me reauthorize multiple times a day, for a app that takes all the good shows and movies off it makes me do a lot of work. if my mom didn't use it I would cancel the subscription.",1,10/13/2025 7:49
Hrini Pfoze,not worth paying. can't find enough movies and dramas.,1,10/13/2025 7:14
Dave OMalia,has problems loading,2,10/13/2025 7:07
Caleb Hurley,"the price keeps going up and they keep lowing the quality and what they offer, it used to be less than $10 for everything now it's $17.99 for 720p. money hungry behavior",1,10/13/2025 7:00
C C,had to block some shows....,1,10/13/2025 6:26
Nancy Kariuki,very fun 💯👍👍,5,10/13/2025 6:19
Hened Çollaku,"As an app it's great. smooth, no problems, everything works great. The content, is why I'm giving 3 stars unfortunately. it's all this propaganda, boring movies and shows with no meaning whatsoever. Same boring thing in every show. And for that price is not worthy anymore",3,10/13/2025 6:16
A Google user,não consigo abrí,2,10/13/2025 6:03
Allison,YOUNG SHELDON 💗💗💗💗💗💗💗💗💗💗,5,10/13/2025 5:52
Matt Emahiser,Removed the option to cast to a TV. That was literally the only reason I had it on my phone.,1,10/13/2025 5:48
Chibuikem,"A bad experience. After paying I tried to watch a film but it refused to play the film. I have uninstalled, reinstalled and even deleted the account to create a new one and nothing is still working",2,10/13/2025 5:23
Lucy,good purfekt,5,10/13/2025 5:11
Bertha Guadalupe Noriega Saavedra,I can't say anything because I haven't tried it yet,4,10/13/2025 4:57
Unorthodox One,took a break from Netflix as paying for sky paramount + and Disney+ used to have the 12.99 membership. I don't really want to pay that so when I try to restart my membership keeps trying to sell me the old plan I was on and there is no option to change this via the app. once you press restart membership it just locks automatically to your previous subscription price even though there is cheaper versions.,2,10/13/2025 4:52
Zaw Zaw Myo Htwe,Ko Zaw Myo Htwe,5,10/13/2025 4:38
Ant Furcello,great,5,10/13/2025 4:01
On Hfkg,thanks ilon musck,1,10/13/2025 3:55
Jacobi Royston,its has good movies on it,5,10/13/2025 3:47
Rita Anthony,I just want to start using it to see how it goes,5,10/13/2025 3:44
arthur shaw,not able to use Netflix,1,10/13/2025 3:12
Adrienne English,best for all entertainment,5,10/13/2025 3:11
Suraj Rawal,nice,5,10/13/2025 2:50
mahi srivastav,this app is the best,5,10/13/2025 2:42
Augustine Amantillo,"Not bad, but most movies or series ain't on my country",5,10/13/2025 2:24
John Gormley,Great shows n movies that i want to watch and games very cool app!,5,10/13/2025 2:24
Danijel Tomic,"Finally found something that might be watchable, and the video is stuck on loading (Google Chrome on PC). Tried other video, the same. Checked internet connection, no problem. Anyway, Netflix is ocean of idiotic, non-watchable content, waste of time.",1,10/13/2025 1:50
Favour Uzochi Samuel,Favour 80*,5,10/13/2025 1:41
Abdul Momin,This app is so amaizing,5,10/13/2025 1:24
Prathamesh Pradip Shelar,The app seems useless at times.The content is unable to load for a longer time than expected and finally nothing.If we are paying for the subscription then why such issues?,1,10/13/2025 1:22
Fahed,worst company ever,1,10/13/2025 1:18
Willie du Plessis,very good,5,10/13/2025 1:18
Aarti Jaiswal,I can't live without Netflix 😭😭,1,10/13/2025 1:13
Ajab Khan,ajabkhan,4,10/13/2025 1:07
Sakhile Mqadii,enjoying 🥰😍,5,10/13/2025 1:05
Zelena Cabral,movie cant dowload,1,10/13/2025 1:01
Manuel Angel Reyes Benavides,no se lo porque Yo Email no Malo cuba no 😒😒⚠️,1,10/13/2025 0:49
Gloria . A Thomas,love the movies,5,10/13/2025 0:47
Bharathi Arjun,disappointed for the shows listed as 12th October but users are able to access it on 13th October.,1,10/13/2025 0:20
Srđan Mičeta,subscribed and paid for a product advertising shows that aren't available in my region. Disingenuous advertising,1,10/13/2025 0:03
Karan Singh,Everything is fine except the download speed is bad and it expires isse acha toh crome se download krke dekhlo kya fyda subscribtion kaa,1,10/12/2025 23:58
ARSATHARSATH Arsath,ARSATHARSATH Arsatha,5,10/12/2025 23:57
Rito nandy,"its pretty much good but please increase your library in the region of india. Its too useless for such a price. You dont even have world wide hits such as Attack on Titan, Friern ect Please look into this matter",3,10/12/2025 23:36
thea Reviwerr,Make Ranma 1/2 marrie Akane,1,10/12/2025 23:31
Nikhil Jha,itna bakbass app life me na dekha salo kuch acha kiya kro 😤,1,10/12/2025 23:28
rvr3,I demand one punch man season 3 now,1,10/12/2025 23:02
Danny DiSabatino,"A show starts on the latest season by default. Normally, I catch this and watch from the beginning, but sometimes it ruins the experience if I just hit play",4,10/12/2025 23:00
Joravar Singh,good ott service provides varieties of content never runs out of content i being using for 1 year and this is worth it some series as stranger things money heist and much more are worth to watch and if you thinking i watch this best content and content never come so this is because I love netflix never runs out of introducing new content every weak,5,10/12/2025 22:47
Roki Sarker,"bhaut ghatiya wala apps hai, bhootni ke, ek bhi pasand ka movie Nahin milta Hai is platform per, faltu mein Paisa barbad",1,10/12/2025 22:44
Youssef Soussi,I couldn't believe it at beginning but this app made my phone glitch aloot ihave iphone 14,1,10/12/2025 22:29
