userName,content,score,at
Disha Banerjee,"so disappointed, this is the first time i installed netflix, i wanted to know how it works and all subscriptions but doesn't even open until and unless you're paying it , keep it on and they will lose it's fans , cuz cheat codes are everywhere without any money",1,10/12/2025 22:13
Ganesh Pavan,Worst application Waste product. They have money and purchase movie or series and they think we are blindfolded. Waste,1,10/12/2025 21:52
حسن,Offensive color content for children ruins children's nature,1,10/12/2025 21:50
Ramamoorthi Ramamoorthi,சுபய் 🎇,5,10/12/2025 21:37
Cameron,"sometimes whenever I try to watch something it glitchs out and I'm force to restart my device, which Is my tablet, or I just can't even use my tablet at all",4,10/12/2025 21:16
Irene Aby,"good app, no ads, unlike some others, and also no added charges.",4,10/12/2025 21:14
Santhi Kosuru,Send about tollywood movies bollywood movies in telugu historical movies in telugu hollywood Chinese movies in telugu tollywood movies in telugu hollywood horror movie Chinese hollywood movies transformer movies jackie Chan movies jurassic park jurassic world terminator movies in telugu Send ramusetu movie karthikeya 2 movie in telugu,5,10/12/2025 21:01
SAI VEDASRUTHI SRUNGAVARAPU,"actually while iam watching a series the subtitles are moving before the scene. it's actually so irritating please make sure you correct it .it happend not only in this series , i faced it in many dramas which i have watched",3,10/12/2025 20:41
malehlohonolo fortunate,I can't download Netflix on my phone,1,10/12/2025 20:24
Jose Jasmond Manicang,ok,5,10/12/2025 20:16
Ataur Hossain,wow😍🤩,5,10/12/2025 20:15
Lopson Hanse,nice app,5,10/12/2025 20:15
Christabel Alagogo Yoruba. Ede Wa Ni Asa Wa,Videos stop playing on my netflix app suddenly. So annoying,1,10/12/2025 20:12
Mustapha mansur Elkilaweey,it couldn't play the downloaded movies,1,10/12/2025 20:06
Steven Snyman,Dance movies,5,10/12/2025 20:03
Shannon,Signed back up because of Elon Musk's little cry about it... if you've upset him you're doing something right 🖖☺️✌️🏳️‍🌈🏳️‍⚧️ oh and yeah and the app works brilliant too...,5,10/12/2025 20:01
edeliza lintao,im enjoy watching,5,10/12/2025 19:32
Ayush Thorat,good,1,10/12/2025 19:30
Scanzy Bwoy,My payment date is not up but they are requesting for payment,1,10/12/2025 19:25
يوسف محمد,Too bad 🤡 this app is nothing,1,10/12/2025 19:14
myanmar crafter,SAIAUNGMURNG,5,10/12/2025 19:08
Apdisee any77,very bad app so bad,1,10/12/2025 19:04
Douglas Wells,"Netflix basic plan now has ads @ $10 a month . the mid range plan is double the price and the only benefit is no adds. absolutely disgusting, I'll be cancelling my account indefinitely. the point of a subscription is to not be getting ads. 1 big middle finger to whoever was the prick that made that call.",1,10/12/2025 18:55
fek fek,ABU Jawahar Rasheed Nagar,5,10/12/2025 18:46
Stefania Cescon,"too expensive and for what? the content is rubbish anyway, one good show maybe every couple of months.. waiting years for season 2 and then it is worse than the first. Infinite choice of shows, spend my evening choosing one instead of actually watching it. Just pointless and NOT worth 13€ a month because NO i won't be paying 5€ just to watch stupid ads",1,10/12/2025 18:46
Chirag,Woke-flix,1,10/12/2025 18:43
Mohit Chandravanshi,superbbb,5,10/12/2025 18:42
Bhupinder Singh,very bad experience please provide 4k in even in basic plan,1,10/12/2025 18:18
Tayo Adeleke,"The app was deactivated on my phone, and all attempts to reinstall proof abortive.",1,10/12/2025 18:04
Thunpisit Carew,"I can't get into my Netflix account due to some household bs, I've always use my phone to watch and the device data. My own wifi, to watch Netflix and when I try to get a code to watch temporary I'm always met with screen that says the link isn't valid.",4,10/12/2025 17:53
Jewel Perocho,this is the most conic i just love everyday every night keep watching this without miss 1 or 2 i just love netflix five star ⭐,5,10/12/2025 17:39
Ajmal Muhajir,good,5,10/12/2025 17:23
HanJie Cheng,2nd edit: been a month since previous review post. controls could not be dismissed on pixel 7 pro by tapping on screen.,3,10/12/2025 17:17
Skibidi Toilet,worst app ever i really need subscription just to play one game y'all just allergic of users y'all are money hungry asf,1,10/12/2025 17:15
Emily _ GT,it is good,5,10/12/2025 17:15
Zohra khan,I can't delete this app from my phone no matter how much I try to,1,10/12/2025 16:56
Chandru Yash,"Im not satisfied while signing in , netmirror is better , netflix waste and membership is too high , on the other hand, prime video and jio hotstar r charging 1500 per annum that too they r providing 4k quality , in simple word netflix is really waste of money , waste waste",1,10/12/2025 16:24
Sarah Wilson,Why am I paying a streaming service that is now full of commercials?? The whole point was to have none.... ridiculous.,1,10/12/2025 15:56
Partha Paul,A great app,5,10/12/2025 15:29
Teclaire Nene,a good app,5,10/12/2025 15:15
Simbu S,good nice app,5,10/12/2025 15:05
Neeraj Bhale,Doesn't even let you use the account when on mobile data,1,10/12/2025 15:03
Niraj Tamang,It is a good app for new movies,5,10/12/2025 14:55
Ricky Eastwood,you can watch everything on Netflix,5,10/12/2025 14:51
Rafiu akeem Ololade,"why do i need to watch another movie, when i never complete the one I'm watching?.. why must i subscribe to higher subscription before I can watch the movie on another device???.. You have a limited movie not every movies is on your app, why???..",2,10/12/2025 14:32
David Drury,"they charged me twice a month for a year, when I worked it out I was refunded for one month and not offered anything else. cancelled straight away. horrible to deal with",1,10/12/2025 14:09
Ankur Kabra,mahnga h ..,1,10/12/2025 14:08
Tasha Nass,"why, in 2025, is it SO damn difficult to reopen the app and pick up where I left off? everytime I try to, it gives me the circle of death and tells me there's an error. even if I completely close out of the app. it's beyond annoying.",1,10/12/2025 14:04
Monish,awesome 👍🏼,5,10/12/2025 13:38
Gojo Zidde,Bhai Se download mat karo ki Kisi kam ka nahin Hai upar Se hate Urdu free recharge nahin deta,3,10/12/2025 13:29
Constance,I'm a new subscriber and I've not been able to sign in. I paid for a month and I was debuted but Netflix has refused to let me use the account I paid for. This is now turning into a big scam. I regret wasting my money.,1,10/12/2025 13:28
Shirtam Panda,bad app,1,10/12/2025 13:21
Ellen Davis,ALL THE ENTERTAINMENT I COULD EVER HAVE,5,10/12/2025 13:15
bipin Thapa,nice,1,10/12/2025 13:12
PRABHAT KUMAR,great,5,10/12/2025 13:04
Sangeeta,aradhya,5,10/12/2025 12:47
gerardo gaming,the prices are crazy😭,1,10/12/2025 11:39
Stephen Clarke,"does not work. I tried signing in, and it kept saying too many tries even when waiting an hour and entering the right information",1,10/12/2025 11:04
Patricia A Spencer,very good,5,10/12/2025 10:49
Ali Haider,very backwash,1,10/12/2025 10:47
Aldrey Batongbacal,It's good but can you update it to android 15? I wanna play GTA San Andreas definitive edition but it says it isn't compatible with Android 15,4,10/12/2025 10:28
Anne Eurich,it gives you time to write or send messages,5,10/12/2025 10:07
Wan Azwan,"gila apa ni wey... phone dan tv dlm rumah yg sama, guna wifi yg sama. tp jd bukan sebahagian dari akaun ini.",1,10/12/2025 9:56
Thoughtful Musician,13 years later... I'm finally canceling this terrible service.,1,10/12/2025 9:54
Rogelio Jr. Salenga,putang Ina lagi nalang kinakaltas ayusin nyo Yung Auto payment,1,10/12/2025 9:50
BRYCE ALLEN,Switch around episodes 8 and 9 of dyno theory is supposed to be the opposite way,5,10/12/2025 9:47
Sujata Tiwari,Good,5,10/12/2025 9:40
Nayab Rasool,"genuinely this app works or opens for only subscription members and not even 1 movie or any series without subscribing we can able to watch, very bad as compared to other OTT 's, but in this app we have best movies and webseries and etc..",1,10/12/2025 9:14
Sampa Bera,PLEASE BRING SOME MORE ANIME IN NETFLIX. Thank you for reducing price.,5,10/12/2025 8:14
Sanjay Sthavaramath,Netflix Not Giving Preference to Kannada Language and When you go to category Tab You will not Find Kannada Filter but you will find All Languages. This Is the Respect we Are getting from this App. I Think kannada people will understand this issue soon. Thank you Guys.😊,1,10/12/2025 7:38
Alexander,I can't ever log in while traveling. Netflix is so determined to screw you out of your money they make it impossible to log in while traveling by requiring an email code that no one ever receives. Just another greedy corporation that keeps hiking their prices. I'm done.,1,10/12/2025 7:34
Jesse Lillo,please let me uninstall ts,1,10/12/2025 7:13
Karen Brown,I love Netflix.,5,10/12/2025 7:06
David Boudreau,Thank you!,5,10/12/2025 6:40
Reem ElHakeem,I love the original stories.. but since it came to the world and all that it does is spread vices among the people 😕💔,1,10/12/2025 6:12
Hyacinth Opetshi,Lovely apps and keep watching movies and TV shows and series I love it,5,10/12/2025 5:42
Yoliann Cruz,ʟᴏᴏᴋɪɴɢ ᴍʏ ғᴀᴠᴏʀɪᴛᴇ ᴍᴏᴠɪᴇs,5,10/12/2025 5:14
Dev Tamang,good service,5,10/12/2025 4:50
Paul Burton,Move my list back to the top please,3,10/12/2025 4:49
Tausha Lunsford,I have canceled this subscription because the monthly subscriptions keeps going up. they do have good movies. But to me it got to expensive.,3,10/12/2025 4:31
Sarah McBryde,"Since the latest update, the app no longer works. I can not get it to open on my phone despite uninstalling and reinstalling, restarting phone. Customers pay good money for something they can't use.",1,10/12/2025 4:27
Sharon Adams,great app for movie nights 👍,5,10/12/2025 4:12
امین کشفی,عالی,5,10/12/2025 3:51
Henry Freeman-Dick,"Unbelievable how restrictive the ""Household"" idea is. My mum works out of town frequently, which means she has to spend extended lengths of time living away from home. During this time, she cannot access a single feature of the app on any of her devices because ""this device is not a part of the Household associated with this account"". Utterly ridiculous. Plus, the ads situation is just a joke. You've strayed so far in the wrong direction from what the app used to be. Disappointing altogether.",1,10/12/2025 3:48
Giorgio Galeazzi,1 star for streaming. -1 star for subtitles missing. -1 star for mirror casting not working. -1 star for disconnecting when not at home for a few weeks. -1 star for no adjustment to brightness.,1,10/12/2025 3:38
Mogamat Yusuf Safodien,this app is awesome it has no lags or glitchs,5,10/12/2025 3:09
Orji Gift,good,5,10/12/2025 3:08
Shimaa Tarek,This app contains and supports inappropriate contents for children and whole family members ...yak,1,10/12/2025 3:06
Trupti ranjan Nayak,pls netflix please fix that 5.10 I have bought the subscription I can't watch anything what's use them I am giving out free money please fix the issue fast,1,10/12/2025 3:05
Ruvainderen Murali,Personally watching this on the TV is a better option I have experience alot of glitches in the mobile version I hope Netflix fixes these bugs,3,10/12/2025 2:56
Sandra,Exhausting app never works for me.,1,10/12/2025 2:52
Ezedo Billgate,Wow such a nice app that can show you alot of movies and entertainment just download it and you will enjoy this app,5,10/12/2025 2:32
Narnette Nthiga (Mumbu`s),Excellent 👌,5,10/12/2025 2:16
Alana Robin,good,5,10/12/2025 2:07
Hussein Saied,"Netflix has completely lost its direction. The platform used to have quality shows, but now it’s full of unnecessary content and poor decisions. I’ve canceled my subscription because it no longer represents what many viewers want to see.",1,10/12/2025 1:55
Isak Hvarfner,Let me use the thing I pay an exorbitant amount of money for please.,1,10/12/2025 1:46
Sachchida nand Upadhyay,"There is a problem playing the video. Please try again. (5.10) I am facing this problem from many days, till now no one has solved my problem, what is the benefit for me in taking Netflix subscription, please solve it.",1,10/12/2025 1:36
Linda Newman,if I can anyone can,5,10/12/2025 1:26
Nauka Shah,we are already paid rs. 199 for one month plan. but facing for update of payment. if paid full for one month so why you against charge from us.,2,10/12/2025 1:14
Eli Gwapos,how do I access the games. I mean I love Netflix but y cant I access the games??,5,10/12/2025 1:03
Mehak Sikandar,Pretty good and works well. has many options to watch specially classic movies 🎬 please Don't remove them.,5,10/12/2025 1:00
madvan stark,always show server error. such a waste,1,10/12/2025 0:33
Ebad E,problem with sign in any accounts,1,10/12/2025 0:11
Peter Collins,what was the point of getting the WWE content if your player constantly breaks whilst playing it?,1,10/12/2025 0:05
Tarakeshvari Tayade at,"So easy to use , and I think that it is Spectacular and Just Wonderful",5,10/12/2025 0:05
Mohd aslam,some days before when netflix tried to promote lgbt I have cancelled my membership and still they didn't cancel my membership as they got to know alot of people have cancelled now they will loose lots of money netflix i swear even if you stop promoting the lgbt I will never ever again buy your membership and I request everyone go to banking app or indian go to upi app and cancel the automatic payment from there,1,10/12/2025 0:04
Kubra Husaain,best app ever the quality is very good 💯,5,10/11/2025 23:49
tapash Das,only for The blind side,5,10/11/2025 23:22
Sana Sadik,Netflix Needs To Add BLUELOCK,4,10/11/2025 23:18
Akhileswar Yaddanapudi,there is a serious bug with automated payment system as it sometimes cant process the payment info and asks to update and repay again. lot of hassle if we want to get the amount refunded as the customer support cant access transactions to their account to verify and we have to go via bank to resolve payment dispute.,1,10/11/2025 23:18
Wesley Jeffers,"i had an account for nearly a decade. I cancelled in July 2024 because they kept increasing their prices and it got to be too expensive for me. I tried logging in today and my email couldn't be found. It took me forever to find their chat, they took a long time to comprehend what I was saying, and it turns out they delete your account permanently after 10 months of inactivity. A decade of my watch history and watchlist gone without warning, no email, no notice. I won't be making a new one.",1,10/11/2025 23:09
Bakiti Mohammed,good,2,10/11/2025 22:58
Hamza Tariq Butt,"Im facing a problem, while video is running, video start crashing... blurry and double vision sounds remains normal why please help me to solve this issue",2,10/11/2025 22:44
Prem Dewangan,bilkul bekaar aap hai login hi nhi horha hai is app ne,1,10/11/2025 22:32
Julia,"We have had a full subscription for over 10 years. App now regularly tells us our devices are not part of our household because they are not connected to the household WiFi....even though our devices ARE connected to the home WiFi and no other WiFi. This makes NO SENSE. Honestly, watching films was easier when you went to a store and rented a physical copy. You knew in advance how much time it would take and usually the only problem would be that they didn't have any available copies left.",1,10/11/2025 22:29
Mycal Berkey,i had the 7.99 plan and then all of a sudden today i was charged $27.00 dollars. netflix changed my plan themselves. the scam known as netflix is growing.,1,10/11/2025 22:03
Jabulile Mbewe,Wow,5,10/11/2025 22:01
Vianca Garcia,it doesn't let me create an acc it takes me back to login stupid thing,1,10/11/2025 22:00
Velvet star night,popcorn sath nhi diye,1,10/11/2025 21:59
علي محمد,it's Not free,1,10/11/2025 21:46
Pramila,omg 👌 👏 😍,5,10/11/2025 21:45
Andy Koh,"Although i've downloaded the Nextflix app on my new Huawei tablet, i can't seem to download any movies....",3,10/11/2025 21:45
Delroy Nyamupinga,Game,5,10/11/2025 21:33
Andy,"Trying to manage my kids' Netflix profile was a nightmare. You can't edit child profiles in the app, and if you try on the web, it forces you back into the app—where edits are blocked. I had to use incognito mode just to bypass the redirect and access proper controls. It's absurdly convoluted for something so basic. Parents need clear, direct access—not a maze of restrictions and redirects.",1,10/11/2025 21:30
#Just MS,"There are not many Kannada movies in the app and for the ones that are there, audio is not Kannada language what is the point of this!?",3,10/11/2025 20:58
Shlok Yadav,"it's very bad app this app is not working well ,also very slow and have account issue 😕",1,10/11/2025 20:50
Prakash Paras,Tv screencast black screen showing but fix this problem,1,10/11/2025 20:48
Charles Ilag,can't play a movie,5,10/11/2025 20:46
Nicola Marciniak,"if you add Pokémon: sun and moon back, like it used to be than maybe I would've given you a 5 star, right now 4 is enough",4,10/11/2025 20:45
CATACUTAN Angeline,amazing,5,10/11/2025 20:37
4bit Sam,hello Netflix please make battlefield or call of duty campaign games for mobile like u release WWE or gta and Raji please I want aaa fps games on my mobile phone please literally I am bored now to play these pubg free fire and cod mobile like multiplayer microtransactions games you port my dream on my phone WWE 25 and now please port battlefield or call of duty campaign please I really appreciate it,5,10/11/2025 20:36
Kevin,love movies this is a great place to look,5,10/11/2025 20:19
Germina Mare,i like it,5,10/11/2025 20:11
muni sekhar,worst,1,10/11/2025 20:05
Oluwakemi Odusoga,excellent app,4,10/11/2025 20:04
Russell Hunter,great,5,10/11/2025 19:58
Araib Qureshi,good,5,10/11/2025 19:43
Ann Hennessy,not to bad quite easy,1,10/11/2025 19:42
Precious Chizzy,I love it,5,10/11/2025 19:42
Essance Harrison,Streaming live sports events and giving notifications better.,5,10/11/2025 19:35
john carlo bitos,Its dim to my tv,4,10/11/2025 19:30
Adithya,I'm requesting Netflix to Put Mobile number and OTP for signing up. Give that option also. please,3,10/11/2025 19:15
MAW SALAD,"Why do you have to remove films man like bro i wanna watch Kamisama Kiss it's already removed, i wanna watch Fullmetal Alchemist Brotherhood it's already removed like can you not😭😭😭😭😭",1,10/11/2025 19:15
j d,"netflix is getting more and more greedy, I'm done with it",1,10/11/2025 18:08
Zaitwa Nanjere,Cool 😎,5,10/11/2025 17:57
Vinuka Dilruwan,great and nice,5,10/11/2025 17:48
Barnali P,after paying this much money i cannot even watch my drama in peace the subtitles is not matching the scenes i have tried every possible way to fix it. shame on you guys,1,10/11/2025 17:48
Luciano Bayi,Good,5,10/11/2025 17:02
Allen Lobo,Best OTT Platform,5,10/11/2025 17:02
Drew Yabuki,"real good but still needs some sorting in the downloads like a letters or arrange them in ""ABC"" kind to arrange the downloads letter by letter and a site where to wach a nice movie at night to 👍",5,10/11/2025 16:43
Apoorv Wadhwa,"apparently owning 2 wifi's mean the guy whose email is attached to the account isnt actually part of the household that has the netflix account....yes,i must go and buy my own netflix DESPITE being the owner of the account who pays for this netflix",1,10/11/2025 16:41
Tahomida Ferdose,Why this is unable for bangladesh,1,10/11/2025 16:39
Thinasande Ndlela,Payment always accumulates without your consent,3,10/11/2025 16:18
Jasvir Singh,jab Tak ap subscription nahi leta hai tab tak ap account create neha kar sakte hai,1,10/11/2025 16:16
DawnBest Jenni,I can't open Netflix,1,10/11/2025 16:09
Samartha Basarkod,Total garbage... Not much shows.,2,10/11/2025 16:09
Patio,5.10 error постоянно,1,10/11/2025 16:05
trisha kantharia,very bad.. i have done the recharge and everything my net ks good still i cant access netflix. its shows only loading and it doesn't play..,1,10/11/2025 15:50
Enrico Hariyanto,"trying to Uninstall, but not allowed to.",1,10/11/2025 15:46
Shivanshu Maurya,please fix error 3.10 issue,3,10/11/2025 15:14
Sachit Choudhary Sachit Choudhary,nice app,5,10/11/2025 14:42
Dorcas Unufe,it is very nice to me,5,10/11/2025 14:30
Tara Williams,This watching app is awesome.,5,10/11/2025 14:19
Adrian Kobi,This is awesome,5,10/11/2025 14:08
TIKESHWAR SAO (TINKU SAO),worlds best ott and best content platform 👌,5,10/11/2025 14:04
Ann Malicad,"very epic app. buncha movies, tv shows, animes. 10/10",5,10/11/2025 13:50
Solanki Shree,I have recently just updated and is not even opening! I have paid for enjoying and I very disappointed.,1,10/11/2025 13:40
Erick Blanco (Shivaio),Installed it just to realize the shameless plans they offer,1,10/11/2025 13:38
Dragon,Long time ago it was good was streaming and get dvds now it's trash so expensive,1,10/11/2025 13:24
Abhishek Faye,kochikame hindi. scary movie hindi,1,10/11/2025 13:22
Hus 9,I can't watch it on my smartphone,1,10/11/2025 13:09
Jennie Phillips,I love Netflix been there should be a deal if you've been with them a long time. It's almost $20 now just to have it debating on deleting my account..,5,10/11/2025 13:04
Cupcake Fan,"I love netflix and all but can you atleast put the movie ""Legend of Korra"" since i want to watch it on netflix and i already watched ""The last airbender"". Thanks✨",5,10/11/2025 12:38
Terry Kavourgias,"Can't disable auto play for smart TVs. Every movie and TV show immediately auto starts playing just by selecting the title's main page. It's horribly frustrating. No way to complain in the app, and trying to contact support via website always returns ""Wait times for chat support are longer than usual right now. Check back later, or search our Help Center for answers.""",1,10/11/2025 12:17
Rahim,this app is so good and best 🥰i like it,5,10/11/2025 12:15
Faith,not all movies and series are found here,4,10/11/2025 12:14
Shah MD. Muhib Ullah,very expensive,1,10/11/2025 12:07
piotr wolodkowicz,"aweful customer experience. Bea was aweful, full of attitute. called to find out why I have to sign in all the time she told me that if I don't like it, I can cancel. put me on hold for an hour.",1,10/11/2025 12:02
Nagebe Ali,great movies,5,10/11/2025 11:38
Lj Carpio,WHY CANT I USE NETFLIX WHEN SOMEONE IS USING NETFLIX TOO BRO CAN I LIKE USE NETFLIX WHEN A FAMILY MEMBER WATCH BRO MY DAD IS LITERALLY AND OFW HOW CAN I USE NETFLIX UGH IM GIVING YOU A ONE STAR,1,10/11/2025 11:35
Aiden Coleman,they upped the price for the subscription and now there adding ads mine as well watch tubi tv actually is free and has less ads than this dam site,1,10/11/2025 11:31
Mergany Shaniz,eh do go j,4,10/11/2025 11:14
Fazdley,"please fix this issue.. ""there is problem playing the video please try again 5.10""",1,10/11/2025 11:12
ETO SLAY,"update new, Netflix now superb in years 2025, subscribe monthly.",5,10/11/2025 11:10
Deep Kumar,durty,1,10/11/2025 10:54
Ganesh K R,don't have kannada movies in the whole platform. since most of the netflix wachers are from bengaluru. still not casting kannada movies .,1,10/11/2025 10:40
Brantley Pugh,it is amazing i got to watch all the episodes of reba without any anturupion,5,10/11/2025 10:39
Herbert Cofer,great,5,10/11/2025 10:04
Astha goel,download option not available on netflix with Android 16. even his support team is not able to resolve... really disappointed..,1,10/11/2025 10:01
Simon Caudwell,Doesn't recognise Dolby Atmos on my Dolby Atmos enabled tablet.,2,10/11/2025 9:52
Mahaboob chand Shaik,Good and quality,5,10/11/2025 9:41
Budi Susanto,good,5,10/11/2025 9:21
Aman Sinha,Why can't i buy annual subscription,1,10/11/2025 9:17
Eleanor Inman-Smith,"I've had a Netflix subscription for many, many years now, and had no problems until early this year. When my subscription plan changed all its policies, making my subscription not ad free anymore, now I get adverts every 5-10 minutes with at least two to three ads in one. It's ridiculous and the clearest scam I've ever seen to get a customer to pay X2 the amount I am currently paying, just to get zero ads and access to all films and series. It's disgusting, really, and an honest disappointment.",1,10/11/2025 9:05
Mary Jane Vicente,best,5,10/11/2025 8:44
Sreelekshmi,"Facing issues with video streaming.It has occurred multiple times, video never loads even after downloading.Tried clearing cache , reinstalled, even updated phone software.",2,10/11/2025 8:39
Ntuthuko Mdletshe,Awesome experience.,5,10/11/2025 8:20
James Kleiner,not worth the cost,2,10/11/2025 7:38
Andrew M,Works perfectly fine.,5,10/11/2025 7:31
Aldi Reynaldi,why can't I login my account to the app but no problem while login it to the web browser??,5,10/11/2025 7:14
Richard Dean,stop promoting transgenderism on our children's show. put that stuff in a separate area that needs a parental code to watch.,1,10/11/2025 7:10
Joaquin Arias Jaime,"Hasta poco apareció un anuncio para actualizar la app con límite del 8 de octubre. A pesar de digirme al enlace de descarga, no se ejecutaba. La app no se encuentra en la App Gallery. En Google Play se encuentra la app y la descargo pero la pantalla se queda en negro. ¿Cómo puedo ver la app de nuevo?",2,10/11/2025 6:55
Samy Byers,"The fact that even the Extra Dim Mode doesn't actually dim the screen well is crazy. Remove the brightness bar, like any other app, or allow it to dim more.",1,10/11/2025 6:37
